1172,اعادة تاهيل وتشغيل البنية التحتية لمسبح الاكاديمية,القوات البرية,250739007560,180 يوم,المقاولات,-114,لم يتم التقديم - لم يتم استلام العرض,13-Jul-25,13-Jul-25,29-Jul-25,مقاولات الإنشاءات العامة (التشييد و بناء المرافق العامة)- إنشاءات عامة,,,,,,,,,,,,,,,,,,,,,
1173,أعمال زراعة للساحات الخارجية في مقر الهيئة العامة للتطوير الدفاعي,الهيئة العامة للتطوير الدفاعي,250739006452,2 شهر,البيئة,-112,لم يتم التقديم - لم يتم استلام العرض,13-Jul-25,13-Jul-25,31-Jul-25,أنشطة زراعية,,,,,,,,,,,,,,,,,,,,,
1174,توريد وتركيب اثاث مكتبي لمكتب سمو نائب امير المنطقة ووكيل امارة منطقة عسير,أمارة منطقة عسير,250739005783,45 يوم,المقاولات,-114,لم يتم التقديم - لم يتم استلام العرض,13-Jul-25,13-Jul-25,29-Jul-25,"
تجارة الأثاث المنزلي والمفروشات والستائر والسجاد
مقاولات عامة للمباني (الانشاء، الإصلاح، الهدم، الترميم)
مقاولات الإنشاءات العامة (التشييد و بناء المرافق العامة)- إنشاءات عامة
خدمات تنجيد الأثاث
التشغيل والصيانة والنظافة للمنشآت - التشغيل والصيانة",,,,,,,,,,,,,,,,,,,,,
1175,تجهيز ورشة قوة أمن وحماية المرافق البحرية بميناء الملك عبدالعزيز بالدمام بالمنطقة الشرقية,حرس الحدود,250739007452,6 شهر,المقاولات,-113,لم يتم التقديم - لم يتم استلام العرض,13-Jul-25,13-Jul-25,30-Jul-25,"مقاولات عامة للمباني (الانشاء، الإصلاح، الهدم، الترميم)",,,,,,,,,,,,,,,,,,,,,
1176,صيانة الشوارع والارصفة والانارة,بلدية محافظة ضمد,250739006770,3 سنة,المقاولات,-99,لم يتم التقديم,13-Jul-25,13-Jul-25,13-Aug-25,مقاولات الإنشاءات العامة (التشييد و بناء المرافق العامة) - إنشاء الطرق,,,,,,,,,,,,,,,,,,,,,
1177,اتفاقية اطارية لتوريد الحيوانات الفطرية والطرائد لمحمية الإمام تركي بن عبدالله الملكية,محمية الإمام تركي بن عبدالله,250739006702,36 شهر,البيطرة,-102,لم يتم الترسية,10-Jul-25,14-Jul-25,10-Aug-25,الخدمات البيئية,"30,060,844.75",شركة محمد عبدالله آل طالب وشركاه للتجارة والزراعة,13453119.75,,,,,,,,,,,,,,,,,,
1178,مشروع الأعمال التكميلية للوحدات المتنقلة لمتابعة المشاريع الميدانية بمحمية الملك عبد العزيز الملكية,محمية الملك عبدالعزيز,250639012725,3 شهر,,-124,فرص - لم يتم ترشيحها,03-Jul-25,14-Jul-25,19-Jul-25,مقاولات الإنشاءات العامة (التشييد و بناء المرافق العامة)- إنشاءات عامة,,,,,,,,,,,,,,,,,,,,,
1179,تشغيل وصيانة ونظافة مركز تطوير صناعة نحل العسل بوادي نمار,وزارة البيئة والمياه والزراعة,250739007313,36 شهر,المقاولات,-98,لم يتم التقديم,14-Jul-25,14-Jul-25,14-Aug-25,التشغيل والصيانة والنظافة للمنشآت - التشغيل والصيانة,,,,,,,,,,,,,,,,,,,,,
1180,تنفيذ أعمال الكشف والمعالجة عن النخيل المصاب بحشرة سوسة النخيل الحمراء بمنطقة عسير,المركز الوطني للوقاية من الآفات والامراض الحيوانية ومكافحتها,250739007641,24 شهر,البيئة,-99,تم التقديم - قبول العرض المالي,13-Jul-25,14-Jul-25,13-Aug-25,أنشطة زراعية,"11,485,021.83",,,,,,,,,,,,,,,,,,,,
1181,OPERATION SERVICES FOR OLFA ANIMAL WELFARE CENTER,Aramco,3001171264, 2 سنة,البيطرة,-77,تم التقديم,06-Jul-25,14-Jul-25,04-Sep-25,,"31,990,203.15",,,,,,,,,,,,,,,,,,,,
1182,Shushah Subsea Cable EPC Project,روابي للمقاولات المتخصصة,4800001370/000,,المقاولات,-133,لم يتم التقديم,,14-Jul-25,10-Jul-25,,,,,,,,,,,,,,,,,,,,,,
1183,تامين مبيدات لدعم هيئة مكافحة الجراد الصحراوي في المنطقة الوسطى,المركز الوطني للوقاية من الآفات والامراض الحيوانية ومكافحتها,250739003240,3 شهر,,-120,فرص انتهى وقت التقديم لها,07-Jul-25,14-Jul-25,23-Jul-25,تجارة المواد الكيماوية,,,,,,,,,,,,,,,,,,,,,
1184,Arabian Leopard Conservation Breeding and Rewilding Centre Operations in AlUla,الهيئة الملكية لمحافظة العلا,DOC207206088,سنة,البيطرة,-101,تم التقديم,07-Jul-25,14-Jul-25,11-Aug-25,,"14,943,305.28",,,,,,,,,,,,,,,,,,,,
1185,استثمار موقع ارض فضاء لأنشاء محطة وقود مع ملحقاتها بقاعدة الملك فيصل البحرية بجدة,القوات البحرية,250739004980,15 سنة,المقاولات,-99,لم يتم التقديم,13-Jul-25,13-Jul-25,13-Aug-25,"مقاولات الإنشاءات العامة (التشييد و بناء المرافق العامة)- إنشاءات عامة
خدمات التأجير
خدمات محطات الوقود وخدمات المركبات الأخرى",,,,,,,,,,,,,,,,,,,,,
1186,إحلال نظام الهواء الطبي ونظام الشفط في مستشفى الملك سلمان بن عبدالعزيز بالرياض,تجمع الرياض الصحي الأول,250739006296,1 شهر,المقاولات,-115,لم يتم التقديم - لم يتم استلام العرض,12-Jul-25,13-Jul-25,28-Jul-25,"مقاولات عامة للمباني (الانشاء، الإصلاح، الهدم، الترميم)",,,,,,,,,,,,,,,,,,,,,
1187,صيانة وتطوير الطرق والحدائق العامة,بلدية محافظة النماص,250639008236,360 يوم,المقاولات,-102,لم يتم التقديم,10-Jul-25,13-Jul-25,10-Aug-25,"مقاولات الإنشاءات العامة (التشييد و بناء المرافق العامة) - إنشاء الطرق
مقاولات فرعية تخصصية (أنشطة التشييد المتخصصة)-إنشاء الطرق",,,,,,,,,,,,,,,,,,,,,
1188,تطوير وتجهيز المساحات المكتبية وغرف الاجتماعات والمطعم بمقر صندوق التنمية الوطني,صندوق التنمية الوطني,250739007156,5 شهر,المقاولات,-101,لن يتم التقديم,11-Jul-25,13-Jul-25,11-Aug-25,"مقاولات عامة للمباني (الانشاء، الإصلاح، الهدم، الترميم)",,,,,,,,,,,,,,,,,,,,,
1189,استبدال كابلات إنارة الطرق بمواقع مختلفة بمدينة ينبع الصناعية,الادارة العامة لمشروع ينبع,250639000151,1 سنة,المقاولات,-98,لم يتم التقديم,10-Jul-25,13-Jul-25,14-Aug-25,"مقاولات الإنشاءات العامة (التشييد و بناء المرافق العامة) - إنشاء الطرق
مقاولات فرعية تخصصية (أنشطة التشييد المتخصصة)-إنشاء الطرق",,,,,,,,,,,,,,,,,,,,,
1190,تأهيل الموقع العام لمحيط كلية العلوم الصحية بمحافظة الرس والتابعة لجامعة القصيم.,جامعة القصيم,250739002932,180 يوم,المقاولات,-116,لم يتم التقديم - لم يتم استلام العرض,10-Jul-25,13-Jul-25,27-Jul-25,"مقاولات عامة للمباني (الانشاء، الإصلاح، الهدم، الترميم)",,,,,,,,,,,,,,,,,,,,,
1191,إعادة تأهيل السور الإداري لمديرية سجون منطقة مكة المكرمة ( 47/25/98 ),المديرية العامة للسجون,250739005685,180 يوم,المقاولات,-102,تم التقديم - فتح العروض الفنية,10-Jul-25,13-Jul-25,10-Aug-25,مقاولات الإنشاءات العامة (التشييد و بناء المرافق العامة)- إنشاءات عامة,"1,929,021.50",,,,,,,,,,,,,,,,,,,,
1192,مشروع تطوير برنامج إدارة معلومات المختبري (LIMS) لإدارة نظام الاعمال البيئية (EMS),المؤسسة العامة للري,250739001253,8 شهر,,-117,فرص - لم يتم ترشيحها,10-Jul-25,15-Jul-25,26-Jul-25,تقنية المعلومات,,,,,,,,,,,,,,,,,,,,,
1193,تأهيل الهياكل الخرسانية في المنطقة السكنية,الادارة العامة لمشروع الجبيل,250539015709,1 سنة,المقاولات,-98,لم يتم التقديم,14-Jul-25,15-Jul-25,14-Aug-25,التشغيل والصيانة والنظافة للمنشآت - التشغيل والصيانة,,,,,,,,,,,,,,,,,,,,,
1194,إنشاء وتجهيز وتأثيث مبنى سكن ضباط بالمواقع الإدارية بجدة,قوات الدفاع الجوي,250439008709,540 يوم,المقاولات,-94,تم التقديم - رفض العرض الفني,14-Jul-25,15-Jul-25,18-Aug-25,"مقاولات عامة للمباني (الانشاء، الإصلاح، الهدم، الترميم)","4,313,078.45",,,,,,,,,,,,,,,,,,,,
1195,إنشاء وتجهيز وتأثيث مبنى سكني بالمواقع الإدارية بجدة,قوات الدفاع الجوي,250439008712,540 يوم,المقاولات,-93,تم التقديم - رفض العرض الفني,14-Jul-25,15-Jul-25,19-Aug-25,"مقاولات عامة للمباني (الانشاء، الإصلاح، الهدم، الترميم)","8,355,828.13",,,,,,,,,,,,,,,,,,,,
1196,مشروع تطوير معرض متنقل,مدينة الملك عبدالله للطاقة الذرية والمتجددة,250639010638,1 سنة,المقاولات,-105,لم يتم التقديم,07-Jul-25,15-Jul-25,07-Aug-25,أنشطة المعارض والمؤتمرات,,,,,,,,,,,,,,,,,,,,,
1197,استكمال عملية هدم وإعادة مسجد الوسيطاء بمركز شلاح بمحافظة الرين,وزارة الشـؤون الاسلامية والدعوة والارشاد,241139015813,8 شهر,المقاولات,-119,لم يتم التقديم - لم يتم استلام العرض,08-Jul-25,15-Jul-25,24-Jul-25,"مقاولات عامة للمباني (الانشاء، الإصلاح، الهدم، الترميم)",,,,,,,,,,,,,,,,,,,,,
1198,توريد أجهزة لمركز أبحاث الذكاء الاصطناعي وتقنيات الاستشعار,جامعة تبوك,250639012344,6 شهر,,-124,فرص - لم يتم ترشيحها,03-Jul-25,15-Jul-25,19-Jul-25,توريد وتركيب أجهزة ومعدات الحاسب الآلي (حاسبات وشبكات وملحقات),,,,,,,,,,,,,,,,,,,,,
1199,التخلص من النفايات البيولوجية,جامعة الملك سعود,250739007466,60 يوم,,-122,فرص - لم يتم ترشيحها,13-Jul-25,15-Jul-25,21-Jul-25,"الصناعة التحويلية الأخرى
أنشطة التدوير وجمع النفايات ومعالجتها وتصريفها واسترجاع المواد
الخدمات البيئية",,,,,,,,,,,,,,,,,,,,,
1200,مكافحة الحيوانات الضالة بمدينة الملك سعود السكنية بديراب لمدة (24) شهراً ميلادياً,وزارة الحرس الوطني,250739007269,24 شهر,البيطرة,-114,لم يتم التقديم - لم يتم استلام العرض,12-Jul-25,15-Jul-25,29-Jul-25,"أنشطة الأمن و السلامة
الخدمات البيئية",,,,,,,,,,,,,,,,,,,,,
1201,تنفيذ أعمال الكشف والمعالجة عن النخيل المصاب بحشرة سوسة النخيل الحمراء بمنطقة الجوف,المركز الوطني للوقاية من الآفات والامراض الحيوانية ومكافحتها,250739007656,24 شهر,البيئة,-97,تم التقديم - قبول العرض الفني,14-Jul-25,15-Jul-25,15-Aug-25,أنشطة زراعية,"9,024,842.93",,,,,,,,,,,,,,,,,,,,
1202,تنفيذ أعمال الكشف والمعالجة عن النخيل المصاب بحشرة سوسة النخيل الحمراء بمنطقة مكة المكرمة,المركز الوطني للوقاية من الآفات والامراض الحيوانية ومكافحتها,250739007649,24 شهر,البيئة,-98,تم التقديم - فتح العروض المالية,14-Jul-25,15-Jul-25,14-Aug-25,أنشطة زراعية,"12,270,058.98",,,,,,,,,,,,,,,,,,,,
1203,تشغيل مبادرة المعلومات الأرصاد والإنذار المبكر لحالات الطقس,المركز الوطني للأرصاد,250739002899,24 شهر,حلول الأبعاد,-100,لن يتم التقديم,10-Jul-25,15-Jul-25,12-Aug-25,تقنية المعلومات,,,,,,,,,,,,,,,,,,,,,
1204,اقامة معرض السلامة البحرية,حرس الحدود - الإعلام والاتصال المؤسسي,250739008400,5 يوم,,-122,فرص - لم يتم ترشيحها,15-Jul-25,15-Jul-25,21-Jul-25,,,,,,,,,,,,,,,,,,,,,,
1205,زراعة نصف مليون شجرة من أشجار المانجروف في محافظة رابغ,الهيئة السعودية للمياه,250539000253,24 شهر,البيئة,-100,الملغاة,14-Jul-25,15-Jul-25,12-Aug-25,أنشطة زراعية,"18,434,500.00",,,,,,,,,,,,,,,,,,,,
1206,انشاء حدائق وممرات مشاة وساحات بمحافظة ضرية ( حديقة الملك سلمان ),بلدية ضرية,250739010536,240 يوم,المقاولات,-109,لم يتم التقديم - لم يتم استلام العرض,16-Jul-25,16-Jul-25,03-Aug-25,"مقاولات عامة للمباني (الانشاء، الإصلاح، الهدم، الترميم)",,,,,,,,,,,,,,,,,,,,,
1207,إنشاء وتجهيز وتأثيث مبني سكني بالموقع الإداري بالشرقية,قوات الدفاع الجوي,250739003112,540 يوم,المقاولات,-74,لم يتم التقديم,16-Jul-25,16-Jul-25,07-Sep-25,"مقاولات عامة للمباني (الانشاء، الإصلاح، الهدم، الترميم)",,,,,,,,,,,,,,,,,,,,,
1208,GREEN HYDROGEN PRODUCTION AND UTILIZATION,المؤسسة العامة لتحلية المياه,S0144-INP-SA-0001,,,-123,لن يتم التقديم,,16-Jul-25,20-Jul-25,,,,,,,,,,,,,,,,,,,,,,
1209,الإتفاقية الإطارية لتأهيل مباني البنك,بنك التنمية الاجتماعية,250739001013,3 سنة,المقاولات,-109,لم يتم التقديم - لم يتم استلام العرض,03-Jul-25,16-Jul-25,03-Aug-25,مقاولات فرعية تخصصية (أنشطة التشييد المتخصصة)- إنشاءات عامة,,,,,,,,,,,,,,,,,,,,,
1210,التجهيزات الفنية والضوئية والعروض التراثية,أمانة منطقة حائل,250739002979,,,-120,فرص انتهى وقت التقديم لها,07-Jul-25,16-Jul-25,23-Jul-25,"مقاولات عامة للمباني (الانشاء، الإصلاح، الهدم، الترميم)",,,,,,,,,,,,,,,,,,,,,
1211,الاتفاقية الإطارية لتقديم خدمات مصاحبة لفعاليات وأنشطة التواصل المؤسسي,مدينة الملك عبدالله للطاقة الذرية والمتجددة,250739005891,3 سنة,,-117,لم يتم التقديم - لم يتم استلام العرض,10-Jul-25,19-Jul-25,26-Jul-25,أنشطة المعارض والمؤتمرات,,,,,,,,,,,,,,,,,,,,,
1212,تنفيذ برامج وأنشطة التدريب لمنسوبي المدينة,مدينة الملك عبدالله للطاقة الذرية والمتجددة,250739007031,2 سنة,السياحة,-96,لن يتم التقديم,16-Jul-25,19-Jul-25,16-Aug-25,أنشطة التدريب,,,,,,,,,,,,,,,,,,,,,
1213,تجهيز مقر كتابة العدل بمبنى المحكمة العامة بدومة الجندل,وزارة العدل - الديوان العام,250739010644,120 يوم,المقاولات,-108,لم يتم التقديم - لم يتم استلام العرض,19-Jul-25,19-Jul-25,04-Aug-25,مقاولات الإنشاءات العامة (التشييد و بناء المرافق العامة)- إنشاءات عامة,,,,,,,,,,,,,,,,,,,,,
1214,توريد أدوات ومعدات للإدارة العامة للاتصال المؤسسي,مدينة الملك عبدالله للطاقة الذرية والمتجددة,250639010848,1 شهر,,-120,فرص انتهى وقت التقديم لها,07-Jul-25,20-Jul-25,23-Jul-25,خدمات النشر والطباعة والدعاية والاعلان والإنتاج الفني,,,,,,,,,,,,,,,,,,,,,
1215,توريد وفرد حبيبات البوليمر بقطر 2-4 ملم الزراعي لتقليل سقيا الماء لبلدية محافظة ضباء,بلدية محافظة ضباء,250739009428,1 شهر,,-110,فرص - لم يتم ترشيحها,17-Jul-25,20-Jul-25,02-Aug-25,أنشطة زراعية,,,,,,,,,,,,,,,,,,,,,
1216,تجهيز مقر الكادر النسائي بمركز ومدرسة الخدمات الصحية,رئاسة هيئة الأركان العامة,250739011875,180 يوم,المقاولات,-106,لم يتم التقديم - لم يتم استلام العرض,20-Jul-25,20-Jul-25,06-Aug-25,"مقاولات عامة للمباني (الانشاء، الإصلاح، الهدم، الترميم)",,,,,,,,,,,,,,,,,,,,,
1217,انشاء بوابة أمنية على طريق السلامة بخشم العان,وزارة الحرس الوطني,250739010545,240 يوم,المقاولات,-108,لم يتم التقديم - لم يتم استلام العرض,19-Jul-25,20-Jul-25,04-Aug-25,مقاولات الإنشاءات العامة (التشييد و بناء المرافق العامة)- إنشاءات عامة,,,,,,,,,,,,,,,,,,,,,
1218,مشروع تحويل جناح رقم 2 إلى غرف عزل بمستشفى الملك عبدالعزيز بالإحساء التابع للشؤون الصحية بوزارة الحرس الوطني,الشؤون الصحیة بوزارة الحرس الوطني,250739011113,12 شهر,المقاولات,-93,لم يتم التقديم,18-Jul-25,20-Jul-25,19-Aug-25,"مقاولات عامة للمباني (الانشاء، الإصلاح، الهدم، الترميم)",,,,,,,,,,,,,,,,,,,,,
1219,صيانة الأرصفة وممرات المشاة بالمجاردة,بلدية محافظة المجاردة,250739007300,180 يوم,المقاولات,-110,لم يتم التقديم - لم يتم استلام العرض,17-Jul-25,20-Jul-25,02-Aug-25,مقاولات الإنشاءات العامة (التشييد و بناء المرافق العامة) - إنشاء الطرق,,,,,,,,,,,,,,,,,,,,,
1220,انشاء مبنى رئاسة قاعدة الامداد والتموين بالمنطقة الجنوبية المرحلة الاولى,القوات البرية,250739011024,540 يوم,المقاولات,-92,لم يتم التقديم,18-Jul-25,20-Jul-25,20-Aug-25,مقاولات الإنشاءات العامة (التشييد و بناء المرافق العامة)- إنشاءات عامة,,,,,,,,,,,,,,,,,,,,,
1221,تشغيل مركز الطوارئ والأزمات مرحلة اولى,أمانة منطقة عسير,250639008372,36 شهر,,-95,فرص - لم يتم ترشيحها,17-Jul-25,20-Jul-25,17-Aug-25,مقاولات فرعية تخصصية (أنشطة التشييد المتخصصة)- إنشاءات عامة,,,,,,,,,,,,,,,,,,,,,
1222,تأهيل مرمى نفايات البلدية,بلدية محافظة المجاردة,250739009295,90 يوم,المقاولات,-110,لم يتم التقديم - لم يتم استلام العرض,17-Jul-25,20-Jul-25,02-Aug-25,مقاولات فرعية تخصصية (أنشطة التشييد المتخصصة)- إنشاءات عامة,,,,,,,,,,,,,,,,,,,,,
1223,صيانة الحدائق والساحات للمراكز التابعة,بلدية محافظة العارضة,250739012628,300 يوم,المقاولات,-106,لم يتم التقديم - لم يتم استلام العرض,20-Jul-25,20-Jul-25,06-Aug-25,التشغيل والصيانة والنظافة للمنشآت - التشغيل والصيانة,,,,,,,,,,,,,,,,,,,,,
1224,Bird Controls and Repelling from Aircraft Hangars,Saudia Technic,,,البيئة,-93,تم التقديم,17-Jul-25,17-Jul-25,19-Aug-25,,"2,542,650.00",,,,,,,,,,,,,,,,,,,,
1225,تطوير شبكة الري السطحية في الأحياء السكنية - المرحلة الاولى,الادارة العامة لمشروع الجبيل,250639005936,1 سنة,البيئة,-92,لم يتم التقديم,20-Jul-25,20-Jul-25,20-Aug-25,مقاولات الإنشاءات العامة (التشييد و بناء المرافق العامة)- إنشاءات عامة,,,,,,,,,,,,,,,,,,,,,
1226,العقد الثاني جمع ونقل والتخلص من النفايات بنطاق غرب الطائف والقرى التابعه لها,أمانة محافظة الطائف,250439012054,60 شهر,الاستدامة,-62,لن يتم التقديم,20-Jul-25,20-Jul-25,19-Sep-25,التشغيل والصيانة والنظافة للمنشآت - التشغيل والصيانة,,,,,,,,,,,,,,,,,,,,,
1227,العقد الرابع جمع ونقل والتخلص من النفايات بنطاق شمال الطائف والقرى التابعه لها,أمانة محافظة الطائف,250439010860,60 شهر,الاستدامة,-62,لن يتم التقديم,20-Jul-25,20-Jul-25,19-Sep-25,التشغيل والصيانة والنظافة للمنشآت - التشغيل والصيانة,,,,,,,,,,,,,,,,,,,,,
1228,تنظيم وتنفيذ جميع أنواع الفعاليات والمناسبات والاجتماعات وخدمات الضيافة لصالح هيئة المساحة الجيولوجية السعودية,هيئة المساحة الجيولوجية السعودية,250639012404,4 سنة,السياحة,-105,لم يتم التقديم,07-Jul-25,20-Jul-25,07-Aug-25,"تجارة المواد الغذائية
خدمات النشر والطباعة والدعاية والاعلان والإنتاج الفني
أنشطة المعارض والمؤتمرات
أنشطة الايواء
أنشطة سياحية",,,,,,,,,,,,,,,,,,,,,
1229,إعادة توطين الثدييات والطيور الرئيسة والمحافظة عليها 2025,محمية الملك سلمان بن عبدالعزيز,250739011872,12 شهر,البيطرة,-95,لم يتم الترسية,17-Jul-25,20-Jul-25,17-Aug-25,الخدمات البيئية,"6,499,683.85",شركة المفاهيم المتقدمة للمقاولات,4986431.25,,,,,,,,,,,,,,,,,,
1230,توريد مبيدات بيئية وحشرية لمكافحة الحشرات,بلدية محافظة املج,250739011438,20 يوم,البيطرة,-110,لم يتم التقديم - لم يتم استلام العرض,17-Jul-25,20-Jul-25,02-Aug-25,"تجارة المواد الكيماوية
الخدمات البيئية",,,,,,,,,,,,,,,,,,,,,
1231,تقديم خدمات استشارية لمختبر المكافحة الحيوية للبعوض الناقل لحمى الضنك عن طريق الولباخيا للعام 2025م,مدينة الملك عبدالعزيز للعلوم والتقنية,250739012935,60 يوم,البيطرة,-116,لم يتم التقديم,20-Jul-25,20-Jul-25,27-Jul-25,الأنشطة الاستشارية الأخرى,,,,,,,,,,,,,,,,,,,,,
1232,مشروع دراسة الوضع الراهن للرقابة على الفعاليات,الهيئة العامة للمعارض والمؤتمرات,250739011083,6 شهر,السياحة,-110,لم يتم التقديم - لم يتم استلام العرض,17-Jul-25,20-Jul-25,02-Aug-25,انشطة الاستشارات الادارية,,,,,,,,,,,,,,,,,,,,,
1233,تأهيل وصيانة شبكة الري بأكاديمية وزارة الداخلية لأمن الحدود,حرس الحدود,250739012276,4 شهر,البيئة,-101,لم يتم التقديم,21-Jul-25,21-Jul-25,11-Aug-25,"مقاولات عامة للمباني (الانشاء، الإصلاح، الهدم، الترميم)",,,,,,,,,,,,,,,,,,,,,
1234,تشغيل وصيانة العدادات على الآبار ونظام التحكم,وزارة البيئة والمياه والزراعة,250739010890,36 شهر,,-95,فرص - لم يتم ترشيحها,17-Jul-25,21-Jul-25,17-Aug-25,خدمات صيانة واصلاح الأجهزة والمعدات والآلات,,,,,,,,,,,,,,,,,,,,,
1235,تشغيل وصيانة المباني والإدارات التابعة لأمانة منطقة الرياض في حي الديرة بمدينة الرياض,أمانة منطقة الرياض,250739008887,36 شهر,المقاولات,-94,لم يتم التقديم,20-Jul-25,21-Jul-25,18-Aug-25,التشغيل والصيانة والنظافة للمنشآت - التشغيل والصيانة,,,,,,,,,,,,,,,,,,,,,
1236,تأمين مبيدات الإصلاح البيئي لمكافحة أفات الصحة العامة لبلدية محافظة رنية,بلدية محافظة رنية,250739011512,10 يوم,البيطرة,-119,لم يتم التقديم - لم يتم استلام العرض,20-Jul-25,21-Jul-25,24-Jul-25,تجارة الحاصلات الزراعية,,,,,,,,,,,,,,,,,,,,,
