788,توريد نباتات وادوات زراعية لفرع الوسطى,قوات الدفاع الجوي,250439012878,15 يوم,البيئة,-202,لم يتم التقديم - لم يتم استلام العرض,23-Apr-25,23-Apr-25,02-May-25,"تجارة الحاصلات الزراعية
أنشطة زراعية",,,,,,,,,,,,,,,,,,,,,
789,توريد أدوية بيطرية لرئاسة الحرس الملكي,رئاسة الحرس الملكي,250439011994,6 شهر,البيطرة,-196,لم يتم التقديم - لم يتم استلام العرض,22-Apr-25,23-Apr-25,08-May-25,"مستودعات الادوية والصيدليات - الأدوية
أنشطة بيطرية",,,,,,,,,,,,,,,,,,,,,
790,تقديم خدمات الدعم الفني لتطبيقات الصحة الواحدة,المركز الوطني للوقاية من الآفات والامراض الحيوانية ومكافحتها,250439008921,48 شهر,البيطرة,-182,لم يتم التقديم - لم يتم استلام العرض,21-Apr-25,23-Apr-25,22-May-25,أنشطة بيطرية,,,,,,,,,,,,,,,,,,,,,
791,تنفيذ حملات إعلامية لزيادة الاستثمار في قطاعي الصحة النباتية والصحة الحيوانية,المركز الوطني للوقاية من الآفات والامراض الحيوانية ومكافحتها,250439011645,24 شهر,السياحة,-181,لم يتم التقديم - لم يتم استلام العرض,21-Apr-25,23-Apr-25,23-May-25,خدمات النشر والطباعة والدعاية والاعلان والإنتاج الفني,,,,,,,,,,,,,,,,,,,,,
792,تشغيل ونظافة المبنى الرئيسي لمركز وقاء,المركز الوطني للوقاية من الآفات والامراض الحيوانية ومكافحتها,250439012414,36 شهر,المقاولات,-194,لن يتم التقديم,24-Apr-25,24-Apr-25,10-May-25,التشغيل والصيانة والنظافة للمنشآت - التشغيل والصيانة,,,,,,,,,,,,,,,,,,,,,
793,حفر بئر بمحطة الأبحاث العلمية بمنطقة مكة المكرمة بمتنزه وادي قديد,المركز الوطني لتنمية الغطاء النباتي ومكافحة التصحر,250439011492,2 شهر,المقاولات,-197,لم يتم التقديم - لم يتم استلام العرض,21-Apr-25,24-Apr-25,07-May-25,مقاولات الإنشاءات العامة (التشييد و بناء المرافق العامة)- إنشاءات عامة,,,,,,,,,,,,,,,,,,,,,
794,تنفيذ أعمال الدراسات الجيوفيزيائية لصالح هيئة المساحة الجيولوجية السعودية,هيئة المساحة الجيولوجية السعودية,250239004937,4 سنة,حلول الأبعاد,-158,تم التقديم - رفض العرض المالي,22-Apr-25,24-Apr-25,15-Jun-25,"التعدين
الأنشطة الاستشارية الأخرى
انشطة الاستشارات الهندسية- اشراف","91,425,092.00",,,,,,,,,,,,,,,,,,,,
795,"Provision of Genomic Analysis of Saudi Arabia Commercial Fish Stock (Transformative Collaboration for Sustainable Fishery
.Management)",Food and Agriculture Organization of the United Nations FAO Office Saudi Arabia,لايوجد,,البيئة,-204,تم التقديم,27-Mar-25,27-Mar-25,30-Apr-25,لايوجد,"721,350",,,,,,,,,,,,,,,,,,,,
796,مشروع الدراسات البيئية لخطه اعادة التأهيل والاغلاق البيئي لمردم النفايات بمدينة حائل,أمانة منطقة حائل,250439013987,12 شهر,الاستدامة,-193,تم التقديم - رفض العرض الفني,25-Apr-25,25-Apr-25,11-May-25,الخدمات البيئية,"2,750,052.50",,,,,,,,,,,,,,,,,,,,
797,تأھیل وتطویر حدیقة الحوازم بمدينة حائل (مرحلة ثانیة),أمانة منطقة حائل,250439010011,180 يوم,المقاولات,-193,لم يتم التقديم - لم يتم استلام العرض,25-Apr-25,25-Apr-25,11-May-25,تجارة مواد البناء والأدوات الكهربائية والصحية,,,,,,,,,,,,,,,,,,,,,
798,توريد مواد وأجهزة مكافحة الآفات والحشرات بالقوة البحرية بجازان,القوات البحرية,250439013543,30 يوم,البيطرة,-194,لم يتم التقديم - لم يتم استلام العرض,24-Apr-25,25-Apr-25,10-May-25,تجارة الحاصلات الزراعية,,,,,,,,,,,,,,,,,,,,,
799,تقديم خدمات جمع وتحليل عينات من التربة والمياه وبناء برامج التسميد لمزارعين النخيل في جميع مناطق المملكة,,250439012707,24 شهر,الاستدامة,-194,لن يتم التقديم,24-Apr-25,25-Apr-25,10-May-25,الخدمات البيئية,,,,,,,,,,,,,,,,,,,,,
800,تأمين لقاحات بيطرية للفصيلة الخيلية,المركز الوطني للوقاية من الآفات والامراض الحيوانية ومكافحتها,250439013609,8 شهر,البيطرة,-192,لم يتم التقديم - لم يتم استلام العرض,24-Apr-25,25-Apr-25,12-May-25,مستودعات الادوية والصيدليات - المستلزمات الطبية,,,,,,,,,,,,,,,,,,,,,
801,عقد توريد أسمدة ومبيدات لأمانة منطقة عسير,أمانة منطقة عسير ,250439005100,180 يوم,البيئة,-197,لن يتم التقديم,21-Apr-25,25-Apr-25,07-May-25,أنشطة زراعية,,,,,,,,,,,,,,,,,,,,,
802,زهور حولية متنوعة لادارة الحدائق,أمانة منطقة الجوف,250439009376,1 شهر,البيئة,-195,لن يتم التقديم,23-Apr-25,24-Apr-25,09-May-25,أنشطة زراعية,,,,,,,,,,,,,,,,,,,,,
803,توريد مواد ومبيدات زراعية وبيئية وبيطرية ومخبرية,بلدية تنومة,250439011434,90 يوم,البيئة,-194,لن يتم التقديم,24-Apr-25,24-Apr-25,10-May-25,تجارة الحاصلات الزراعية,,,,,,,,,,,,,,,,,,,,,
804,توريد ثيل طبيعي,أمانة محافظة حفر الباطن,250439013719,30 شهر,البيئة,-194,لم يتم التقديم - لم يتم استلام العرض,24-Apr-25,24-Apr-25,10-May-25,أنشطة زراعية,,,,,,,,,,,,,,,,,,,,,
805,اتفاقية إطارية لتقديم الخدمات الفنية والهندسية والاستشارية والمساحية بالمدينة,مدينة الملك عبدالله للطاقة الذرية والمتجددة,250439013509,3 سنة,المقاولات,-193,لن يتم التقديم,24-Apr-25,24-Apr-25,11-May-25,انشطة الاستشارات الهندسية - تصميم,,,,,,,,,,,,,,,,,,,,,
806,الحصول على جائزة نظام إدارة الجودة 9001 ISO,صندوق التنمية السياحي,250439012587,6 شهر,البيئة,-194,لن يتم التقديم,24-Apr-25,24-Apr-25,10-May-25,انشطة الاستشارات الادارية,,,,,,,,,,,,,,,,,,,,,
807,مواد واجهزة ومستلزمات مراقبة جودة الحياة البحرية والفطرية,الادارة العامة لمشروع ينبع,250439010965,90 يوم,البيئة,-195,لم يتم التقديم - لم يتم استلام العرض,23-Apr-25,27-Apr-25,09-May-25,"تجارة الأدوات والآلات والأجهزة
تجارة المواد الكيماوية",,,,,,,,,,,,,,,,,,,,,
808,تأمين مستلزمات مخبرية,المركز الوطني للوقاية من الآفات والامراض الحيوانية ومكافحتها,241139010318,48 شهر,البيطرة,-173,لم يتم التقديم - لم يتم استلام العرض,27-Apr-25,27-Apr-25,31-May-25,مستودعات الادوية والصيدليات - المستلزمات الطبية,,,,,,,,,,,,,,,,,,,,,
809,خدمات السفر والسياحة لبنك المنشآت الصغيرة والمتوسطة,بنك المنشآت الصغيرة والمتوسطة,250439014723,1 سنة,السياحة,-189,لم يتم التقديم - لم يتم استلام العرض,29-Apr-25,29-Apr-25,15-May-25,أنشطة سياحية,,,,,,,,,,,,,,,,,,,,,
810,تأمين مبيدات الحشرات والقوارض لفرع الغربية,قوات الدفاع الجوي,250439005804,15 يوم,البيطرة,-191,لم يتم التقديم - لم يتم استلام العرض,28-Apr-25,29-Apr-25,13-May-25,"تجارة الحاصلات الزراعية
تجارة الكماليات
تجارة مواد البناء والأدوات الكهربائية والصحية",,,,,,,,,,,,,,,,,,,,,
811,"منافسة توريد أعلاف خضراء ومركزات حيوانية بمحطة الأبحاث والتدريب بالجامعة	جامعة الملك فيصل",جامعة الملك فيصل,250439011045,1 سنة,البيئة,-179,لن يتم التقديم,25-Apr-25,29-Apr-25,25-May-25,"تجارة الحاصلات الزراعية
تجارة المواشي والدواجن والأسماك ومنتجاتها",,,,,,,,,,,,,,,,,,,,,
812,تنفيذ فعاليات داخلية لهيئة تطوير محمية الملك عبد العزيز الملكية,محمية الملك عبدالعزيز,250439015491,1 سنة,السياحة,-189,لم يتم التقديم - لم يتم استلام العرض,25-Apr-25,29-Apr-25,15-May-25,خدمات النشر والطباعة والدعاية والاعلان والإنتاج الفني,,,,,,,,,,,,,,,,,,,,,
813,توريد الزي الميداني لهيئة تطوير محمية الامير محمد بن سلمان الملكية,محمية الأمير محمد بن سلمان,250439006521,3 سنة,,-174,فرص - لم يتم ترشيحها,25-Apr-25,29-Apr-25,30-May-25,تجارة الملابس والأقمشة والعطور والساعات وأدوات التجميل والنظارات,,,,,,,,,,,,,,,,,,,,,
814,الصيانة والنظافة للمبنى الرئيسي للمركز الوطني لتنمية الحياة الفطرية والمحميات التابعة له,المركز الوطني لتنمية الحياة الفطرية,250439014349,3 سنة,المقاولات,-173,لم يتم التقديم - لم يتم استلام العرض,27-Apr-25,29-Apr-25,31-May-25,التشغيل والصيانة والنظافة للمنشآت - التشغيل والصيانة,,,,,,,,,,,,,,,,,,,,,
815,مشروع تجهيز البنية التحتية لمقر مركز مائي في الرياض,المركز الوطني لكفاءه وترشيد المياه,250439013180,90 يوم,المقاولات,-191,لم يتم التقديم - لم يتم استلام العرض,23-Apr-25,29-Apr-25,13-May-25,تقنية المعلومات,,,,,,,,,,,,,,,,,,,,,
816,صيانة الابار في محافظة الخرج,أمانة منطقة الرياض,250439014170,90 يوم,المقاولات,-189,لم يتم التقديم - لم يتم استلام العرض,29-Apr-25,29-Apr-25,15-May-25,التشغيل والصيانة والنظافة للمنشآت - التشغيل والصيانة,,,,,,,,,,,,,,,,,,,,,
817,إنشاء مبنى فرع صندوق التنمية الزراعية بمنطقة المدينة المنورة,صندوق التنمية الزراعية,250439017057,15 شهر,المقاولات,-171,تم التقديم - رفض العرض الفني,29-Apr-25,29-Apr-25,02-Jun-25,مقاولات الإنشاءات العامة (التشييد و بناء المرافق العامة)- إنشاءات عامة,"12,313,050.00",,,,,,,,,,,,,,,,,,,,
818,مشروع ترحيل المخلفات من المردم بقاعدة الملك فيصل البحرية,القوات البحرية,250439016500,730 يوم,الاستدامة,-174,لن يتم التقديم,29-Apr-25,29-Apr-25,30-May-25,مقاولات الإنشاءات العامة (التشييد و بناء المرافق العامة)- إنشاءات عامة,,,,,,,,,,,,,,,,,,,,,
819,مشروع إنشاء المستودع الكيميائي بشطر الطالبات - الفيصلية,جامعة جدة,250439015251,210 يوم,المقاولات,-189,لم يتم التقديم - لم يتم استلام العرض,27-Apr-25,29-Apr-25,15-May-25,"مقاولات عامة للمباني (الانشاء، الإصلاح، الهدم، الترميم)",,,,,,,,,,,,,,,,,,,,,
820,مشروع تركيب مظلات وتخطيط مواقف بجامعة جدة,جامعة جدة,250439013302,30 يوم,المقاولات,-195,لم يتم التقديم - لم يتم استلام العرض,23-Apr-25,29-Apr-25,09-May-25,"مقاولات عامة للمباني (الانشاء، الإصلاح، الهدم، الترميم)",,,,,,,,,,,,,,,,,,,,,
821,مشروع إنشاء سور خرساني لمحطة توزيع الكهرباء بميادين الرماية بالشعيبة رقم 7180 حسب الشروط والمواصفات المرفقة,وكالة الحرس الوطني القطاع الغربي,250439016554,45 يوم,المقاولات,-196,لم يتم التقديم - لم يتم استلام العرض,29-Apr-25,29-Apr-25,08-May-25,"مقاولات عامة للمباني (الانشاء، الإصلاح، الهدم، الترميم)",,,,,,,,,,,,,,,,,,,,,
822,منافسة إنشاء مركز بيانات احتياطي للتعافي من الكوارث في الحوسبة السحابية للهيئة,الهيئة السعودية لتنظيم الكهرباء,250439016800,1 سنة,المقاولات,-190,لم يتم التقديم - لم يتم استلام العرض,28-Apr-25,29-Apr-25,14-May-25,تقنية المعلومات,,,,,,,,,,,,,,,,,,,,,
823,إنشاء عنابر مستعجلة لإدارة سجن محافظة بيشة ( 46/25/49),المديرية العامة للسجون,250439007855,240 يوم,المقاولات,-157,تم التقديم - فتح العروض المالية,28-Apr-25,28-Apr-25,16-Jun-25,مقاولات الإنشاءات العامة (التشييد و بناء المرافق العامة)- إنشاءات عامة,"22,078,595.85",,,,,,,,,,,,,,,,,,,,
824,تشغيل وصيانة سدود المجموعة الأولى بمنطقة الرياض (أ) بجميع ملحقاتها,المؤسسة العامة للري,250439016075,24 شهر,المقاولات,-174,لم يتم التقديم - لم يتم استلام العرض,29-Apr-25,29-Apr-25,30-May-25,التشغيل والصيانة والنظافة للمنشآت - التشغيل والصيانة,,,,,,,,,,,,,,,,,,,,,
825,استكمال السور الجنوبي بالقوة البحرية بجازان,القوات البحرية,250439014455,300 يوم,المقاولات,-190,لم يتم التقديم - لم يتم استلام العرض,28-Apr-25,29-Apr-25,14-May-25,"تجارة مواد البناء والأدوات الكهربائية والصحية
مقاولات عامة للمباني (الانشاء، الإصلاح، الهدم، الترميم)
إمدادات الكهرباء والغاز والمياه والبخار وتكييف الهواء",,,,,,,,,,,,,,,,,,,,,
826,الفعاليات الرئيسية بحي السفارات 2025,الهيئة الملكية لمدينة الرياض,250439012550,12 شهر,المقاولات,-175,لم يتم التقديم - لم يتم استلام العرض,28-Apr-25,29-Apr-25,29-May-25,أنشطة المعارض والمؤتمرات,,,,,,,,,,,,,,,,,,,,,
827,تطوير موقع الصندوق (الداخلي والخارجي) وتحسين تجربة المستخدم,صندوق التنمية الزراعية,250439011398,1 سنة,المقاولات,-191,لم يتم التقديم - لم يتم استلام العرض,22-Apr-25,29-Apr-25,13-May-25,تقنية المعلومات,,,,,,,,,,,,,,,,,,,,,
828, استكمال تدعيم صيانة وتحسين وتشغيل طريق الملك عبد العزيز بمحافظة الجبيل (جودة الحياة),بلدية محافظة الجبيل,250339014914,12 شهر,المقاولات,-181,لم يتم التقديم - لم يتم استلام العرض,22-Apr-25,29-Apr-25,23-May-25,التشغيل والصيانة والنظافة للمنشآت - التشغيل وصيانة الطرق,,,,,,,,,,,,,,,,,,,,,
829,مشروع إدارة المركز الإعلامي لأنشطة التواصل المؤسسي,وزارة الموارد البشرية والتنمية الاجتماعية,250439011928,18 شهر,السياحة,-181,لم يتم التقديم - لم يتم استلام العرض,22-Apr-25,29-Apr-25,23-May-25,خدمات النشر والطباعة والدعاية والاعلان والإنتاج الفني,,,,,,,,,,,,,,,,,,,,,
830,"تطوير السياسات واللوائح، والمتطلبات الفنية لمركبات التنقل الخضراء في المملكة العربية السعودية",الهيئة العامة للنقل,250439009004,6 شهر,الاستدامة,-172,تم التقديم,21-Apr-25,29-Apr-25,01-Jun-25,الأنشطة الاستشارية الأخرى,"1,948,100.00",,,,,,,,,,,,,,,,,,,,
831,تأهيل وتطوير المقر الرئيسي للهيئة السعودية لتسويق الاستثمار-مبنى كيرف,وزارة الاستثمار,241039020193,10 شهر,المقاولات,-189,لم يتم التقديم - لم يتم استلام العرض,19-Mar-25,29-Apr-25,15-May-25,"مقاولات عامة للمباني (الانشاء، الإصلاح، الهدم، الترميم)",,,,,,,,,,,,,,,,,,,,,
832,مشروع صيانة الطرق المحيطة بالموقع العام لمباني أمانة المنطقة الشرقية -المرحلة الثانية,أمانة المنطقة الشرقية,250439006280,12 شهر,المقاولات,-200,لم يتم التقديم - لم يتم استلام العرض,16-Mar-25,29-Apr-25,04-May-25,التشغيل والصيانة والنظافة للمنشآت - التشغيل وصيانة الطرق,,,,,,,,,,,,,,,,,,,,,
833,مشروع الحملات الإعلامية لوكالة الرقابة وتطوير بيئة العمل,وزارة الموارد البشرية والتنمية الاجتماعية,250439014548,24 شهر,السياحة,-176,لم يتم التقديم - لم يتم استلام العرض,27-Apr-25,29-Apr-25,28-May-25,"خدمات النشر والطباعة والدعاية والاعلان والإنتاج الفني
أنشطة المعارض والمؤتمرات",,,,,,,,,,,,,,,,,,,,,
834,اتفاقية إطارية ( مغلقة ) توريد وتركيب متطلبات تهيئة بيئة العمل لمباني الهيئة العامة للمساحة والمعلومات الجيومكانية,الهيئة العامة للمساحة والمعلومات الجيومكانية,250439009183,12 شهر,المقاولات,-192,لم يتم التقديم - لم يتم استلام العرض,27-Apr-25,29-Apr-25,12-May-25,تجارة مواد البناء والأدوات الكهربائية والصحية,,,,,,,,,,,,,,,,,,,,,
835,برنامج صيانة نظام المعلومات الجيومكاني,وزارة الداخلية - الديوان العام,250339000531,12 شهر,حلول الأبعاد,-182,لم يتم التقديم - لم يتم التعميد,24-Apr-25,29-Apr-25,22-May-25,تقنية المعلومات,,,,,,,,,,,,,,,,,,,,,
836,تشغيل وصيانة نظم المعلومات الجغرافية,هيئة الرقابة النووية والإشعاعية,250439008143,2 سنة,حلول الأبعاد,-195,الملغاة,23-Apr-25,29-Apr-25,09-May-25,تقنية المعلومات,"11,328,075.00",,,,,,,,,,,,,,,,,,,,
837,نظام إدارة المعلومات الجغرافية,الهيئة العامة للصناعات العسكرية,250339016693,18 شهر,حلول الأبعاد,-197,لم يتم الترسية,27-Apr-25,29-Apr-25,07-May-25,تقنية المعلومات,"7,727,998.85",شركة افاق البيئه المحدوده,2780700.00,,,,,,,,,,,,,,,,,,
838,حدائق ومنتزهات وساحات وممرات مشاة – حديقة الجفة,بلدية محافظة حبونا,250439009897,18 شهر,المقاولات,-181,لم يتم التقديم - لم يتم استلام العرض,22-Apr-25,29-Apr-25,23-May-25,"مقاولات الإنشاءات العامة (التشييد و بناء المرافق العامة)- إنشاءات عامة
مقاولات فرعية تخصصية (أنشطة التشييد المتخصصة)- إنشاءات عامة",,,,,,,,,,,,,,,,,,,,,
839,تحسين وانسنة المشهد الحضري بمدينة ينبع الصناعية,الادارة العامة لمشروع ينبع,240639015708,3 سنة,المقاولات,-148,لم يتم التقديم - لم يتم استلام العرض,23-Apr-25,29-Apr-25,25-Jun-25,مقاولات الإنشاءات العامة (التشييد و بناء المرافق العامة)- إنشاءات عامة,,,,,,,,,,,,,,,,,,,,,
840,توريد ادوية بيطرية,القوات البرية,250439010845,30 يوم,البيطرة,-197,لم يتم الترسية,21-Apr-25,05-May-25,07-May-25,أنشطة بيطرية,"310,312.55",مؤسسة نوف بنت محمد البصيلان,95335,,,,,,,,,,,,,,,,,,
841,"سقيا ورعاية 1,200,000 شتلة لمنطقة بوهان المرحلة الثانية",محمية الملك سلمان بن عبدالعزيز,250539000789,6 شهر,البيئة,-187,لم يتم الترسية,01-May-25,01-May-25,17-May-25,أنشطة زراعية,"7,620,475.00",مؤسسة أشغال النهار للمقاولات,2399981,,,,,,,,,,,,,,,,,,
842,سقيا ورعاية 500.000 شتلة مشروع معارك المرحلة الثانية,محمية الملك سلمان بن عبدالعزيز,250539000790,6 شهر,البيئة,-187,لم يتم الترسية,01-May-25,01-May-25,17-May-25,أنشطة زراعية,"3,174,831.45",شركة الفاديم المحدودة,999999.99,,,,,,,,,,,,,,,,,,
843,سقيا ورعاية 300.000 شتلة مشروع مغيرا المرحلة الثانية,محمية الملك سلمان بن عبدالعزيز,250539000793,5 شهر,البيئة,-187,لم يتم الترسية,01-May-25,01-May-25,17-May-25,أنشطة زراعية,"2,248,642.15",شركة الفاديم المحدودة,500000.00,,,,,,,,,,,,,,,,,,
844,تأهيل وصيانة نظام الري والزراعة بأكاديمية وزارة الداخلية لأمن الحدود بمحافظة بقيق بالمنطقة الشرقية,المديرية العامة لحرس الحدود,250439017992,30 يوم,المقاولات,-188,لن يتم التقديم,30-Apr-25,05-May-25,16-May-25,أنشطة زراعية,,,,,,,,,,,,,,,,,,,,,
845,تأمين مبيدات وأسمدة لأعمال صيانة الحدائق والمتنزهات لبلدية محافظة القويعية,أمانة منطقة الرياض ,250539000173,30 يوم,البيئة,-187,لم يتم التقديم - لم يتم استلام العرض,01-May-25,05-May-25,17-May-25,أنشطة زراعية,,,,,,,,,,,,,,,,,,,,,
846,طلب زهور متنوعة للإدارة العامة للحدائق بأمانة منطقة الجوف,أمانة منطقة الجوف,250439016470,1 شهر,البيئة,-188,لم يتم التقديم - لم يتم استلام العرض,30-Apr-25,05-May-25,16-May-25,أنشطة زراعية,,,,,,,,,,,,,,,,,,,,,
847,تقديم خدمات فحص العينات المخبرية للأمراض الحيوانية والنباتية في جميع مناطق المملكة,المركز الوطني للوقاية من الآفات والامراض الحيوانية ومكافحتها,250439015724,36 شهر,البيطرة,-172,لم يتم الترسية,01-May-25,05-May-25,01-Jun-25,الخدمات البيئية,"24,039,140.00",شركة د علي صالح الدهيمان للاستشارات البيئية,18959555.5,,,,,,,,,,,,,,,,,,
848,إنشاء وتنفيذ أعمال اقفاص خارجية في محمية الإمام تركي بن عبدالله الملكية,محمية الإمام تركي بن عبدالله,250539000934,5 شهر,المقاولات,-183,لم يتم التقديم - لم يتم استلام العرض,04-May-25,05-May-25,21-May-25,مقاولات فرعية تخصصية (أنشطة التشييد المتخصصة)- إنشاءات عامة,,,,,,,,,,,,,,,,,,,,,
849,انشاء وحدة تنقية المياه ببقعاء المرحلة الثانية مع ربط الوحدة بالآبار و وحدة الضخ و الخطوط الناقلة,الهيئة السعودية للمياه,250439012057,360 يوم,المقاولات,-138,فرص انتهى وقت التقديم لها,05-May-25,05-May-25,05-Jul-25, إمدادات الكهرباء والغاز والمياه والبخار وتكييف الهواء,,,,,,,,,,,,,,,,,,,,,
850,مشروع إعداد التصاميم الداخلية لمبنى المقر الجديد لهيئة تطوير محمية الملك عبد العزيز الملكية,محمية الملك عبدالعزيز ,250439017153,4 شهر,المقاولات,-186,لم يتم التقديم - لم يتم استلام العرض,01-May-25,05-May-25,18-May-25, انشطة الاستشارات الهندسية - تصميم,,,,,,,,,,,,,,,,,,,,,
851,مشروع الخدمات الاستشارية للدراسات والتصاميم للمراكز التراثية,محمية الملك عبدالعزيز ,250439015085,8 شهر,المقاولات,-188,لن يتم التقديم,30-Apr-25,05-May-25,16-May-25,انشطة الاستشارات الهندسية - تصميم,,,,,,,,,,,,,,,,,,,,,
